imageSet,imgUrl,imgDesc
26,http://lorempixel.com/640/480/city,"The SMTP protocol is down, input the optical circuit so we can input the COM interface!"
26,http://lorempixel.com/640/480/city,"You can't calculate the bandwidth without indexing the solid state SDD transmitter!"
26,http://lorempixel.com/640/480/city,"The COM application is down, calculate the multi-byte application so we can reboot the SMTP bandwidth!"
26,http://lorempixel.com/640/480/city,"Try to calculate the HTTP pixel, maybe it will navigate the primary firewall!"
27,http://lorempixel.com/640/480/city,"If we override the card, we can get to the CSS protocol through the optical USB circuit!"
27,http://lorempixel.com/640/480/city,"Try to input the HDD protocol, maybe it will compress the wireless feed!"
27,http://lorempixel.com/640/480/city,We need to hack the back-end PNG hard drive!
27,http://lorempixel.com/640/480/city,"quantifying the capacitor won't do anything, we need to generate the back-end PNG sensor!"
28,http://lorempixel.com/640/480/city,We need to connect the bluetooth JBOD interface!
28,http://lorempixel.com/640/480/city,"Try to override the XSS interface, maybe it will index the multi-byte system!"
28,http://lorempixel.com/640/480/city,"The THX application is down, navigate the bluetooth system so we can input the EXE port!"
28,http://lorempixel.com/640/480/city,"bypassing the system won't do anything, we need to input the solid state SMTP alarm!"
28,http://lorempixel.com/640/480/city,"Use the multi-byte SQL protocol, then you can input the virtual microchip!"
28,http://lorempixel.com/640/480/city,We need to parse the primary USB feed!
28,http://lorempixel.com/640/480/city,"I'll hack the neural GB matrix, that should monitor the JSON panel!"
29,http://lorempixel.com/640/480/city,"Use the auxiliary SAS matrix, then you can navigate the solid state microchip!"
29,http://lorempixel.com/640/480/city,"Try to synthesize the PNG array, maybe it will input the primary driver!"
29,http://lorempixel.com/640/480/city,"The JBOD driver is down, index the bluetooth matrix so we can generate the RAM hard drive!"
29,http://lorempixel.com/640/480/city,"navigating the matrix won't do anything, we need to reboot the multi-byte AI hard drive!"
29,http://lorempixel.com/640/480/city,"The PNG panel is down, input the back-end hard drive so we can reboot the HTTP driver!"
30,http://lorempixel.com/640/480/city,"If we hack the monitor, we can get to the USB interface through the back-end CSS interface!"
30,http://lorempixel.com/640/480/city,"overriding the bandwidth won't do anything, we need to back up the auxiliary XML alarm!"
30,http://lorempixel.com/640/480/city,"I'll bypass the mobile SAS program, that should alarm the SMTP panel!"
30,http://lorempixel.com/640/480/city,"navigating the firewall won't do anything, we need to compress the mobile JBOD capacitor!"
30,http://lorempixel.com/640/480/city,"hacking the application won't do anything, we need to calculate the mobile HDD matrix!"
30,http://lorempixel.com/640/480/city,"Use the primary AI pixel, then you can generate the solid state protocol!"
30,http://lorempixel.com/640/480/city,"quantifying the application won't do anything, we need to synthesize the virtual XML card!"
30,http://lorempixel.com/640/480/city,"You can't navigate the panel without compressing the back-end GB hard drive!"
30,http://lorempixel.com/640/480/city,"You can't hack the system without navigating the redundant EXE bandwidth!"
30,http://lorempixel.com/640/480/city,"You can't program the capacitor without transmitting the redundant COM driver!"
30,http://lorempixel.com/640/480/city,"You can't parse the transmitter without calculating the optical USB hard drive!"
30,http://lorempixel.com/640/480/city,"I'll navigate the mobile TCP protocol, that should interface the PCI application!"
31,http://lorempixel.com/640/480/city,We need to synthesize the back-end FTP application!
31,http://lorempixel.com/640/480/city,"You can't input the alarm without quantifying the solid state HTTP capacitor!"
31,http://lorempixel.com/640/480/city,We need to transmit the primary RSS matrix!
31,http://lorempixel.com/640/480/city,"I'll index the optical AGP protocol, that should card the RSS microchip!"
32,http://lorempixel.com/640/480/city,"If we transmit the array, we can get to the COM matrix through the 1080p AI pixel!"
32,http://lorempixel.com/640/480/city,"You can't calculate the bandwidth without indexing the solid state XSS system!"
32,http://lorempixel.com/640/480/city,"Try to back up the EXE bandwidth, maybe it will reboot the multi-byte application!"
32,http://lorempixel.com/640/480/city,"I'll input the multi-byte IB hard drive, that should matrix the SAS monitor!"
32,http://lorempixel.com/640/480/city,We need to program the auxiliary AGP interface!
33,http://lorempixel.com/640/480/city,"If we program the monitor, we can get to the AGP program through the primary XSS matrix!"
33,http://lorempixel.com/640/480/city,"I'll hack the 1080p GB hard drive, that should bandwidth the AI bandwidth!"
33,http://lorempixel.com/640/480/city,"I'll compress the multi-byte SAS application, that should transmitter the CSS system!"
33,http://lorempixel.com/640/480/city,"generating the card won't do anything, we need to hack the optical PCI array!"
34,http://lorempixel.com/640/480/city,We need to parse the neural GB pixel!
34,http://lorempixel.com/640/480/city,"You can't bypass the alarm without navigating the optical SAS firewall!"
34,http://lorempixel.com/640/480/city,"You can't copy the application without backing up the solid state PCI port!"
34,http://lorempixel.com/640/480/city,"quantifying the panel won't do anything, we need to override the virtual SSL pixel!"
34,http://lorempixel.com/640/480/city,"If we program the matrix, we can get to the AI program through the auxiliary SSL sensor!"
34,http://lorempixel.com/640/480/city,"You can't calculate the driver without hacking the redundant JSON matrix!"
34,http://lorempixel.com/640/480/city,"If we connect the sensor, we can get to the XML interface through the solid state RSS microchip!"
34,http://lorempixel.com/640/480/city,We need to hack the auxiliary SMS port!
34,http://lorempixel.com/640/480/city,"generating the program won't do anything, we need to back up the back-end SAS bandwidth!"
34,http://lorempixel.com/640/480/city,We need to parse the redundant SSL monitor!
34,http://lorempixel.com/640/480/city,"compressing the firewall won't do anything, we need to index the 1080p HTTP program!"
35,http://lorempixel.com/640/480/city,"Try to bypass the THX capacitor, maybe it will back up the haptic array!"
35,http://lorempixel.com/640/480/city,"I'll synthesize the neural RSS capacitor, that should program the SMS hard drive!"
35,http://lorempixel.com/640/480/city,"Try to generate the THX circuit, maybe it will input the optical feed!"
35,http://lorempixel.com/640/480/city,"If we hack the pixel, we can get to the GB pixel through the auxiliary HTTP array!"
35,http://lorempixel.com/640/480/city,"If we override the card, we can get to the XSS capacitor through the open-source GB program!"
35,http://lorempixel.com/640/480/city,"You can't input the microchip without copying the wireless HDD driver!"
35,http://lorempixel.com/640/480/city,"You can't transmit the program without calculating the multi-byte TCP program!"
36,http://lorempixel.com/640/480/city,"The JBOD pixel is down, input the primary matrix so we can override the RAM matrix!"
36,http://lorempixel.com/640/480/city,We need to reboot the neural AGP hard drive!
36,http://lorempixel.com/640/480/city,"Try to generate the IB panel, maybe it will generate the optical transmitter!"
36,http://lorempixel.com/640/480/city,"The XML card is down, copy the 1080p bandwidth so we can connect the USB system!"
36,http://lorempixel.com/640/480/city,"Use the multi-byte SCSI pixel, then you can input the 1080p pixel!"
36,http://lorempixel.com/640/480/city,"If we program the matrix, we can get to the AGP protocol through the redundant XSS monitor!"
36,http://lorempixel.com/640/480/city,"Try to index the SSL protocol, maybe it will generate the wireless pixel!"
36,http://lorempixel.com/640/480/city,"If we compress the sensor, we can get to the JSON matrix through the auxiliary ADP program!"
36,http://lorempixel.com/640/480/city,"The SSL driver is down, hack the auxiliary application so we can quantify the JSON system!"
36,http://lorempixel.com/640/480/city,We need to hack the auxiliary XSS microchip!
36,http://lorempixel.com/640/480/city,We need to copy the virtual AI microchip!
36,http://lorempixel.com/640/480/city,"Use the open-source AI interface, then you can generate the mobile transmitter!"
37,http://lorempixel.com/640/480/city,"You can't input the firewall without parsing the mobile HDD bandwidth!"
37,http://lorempixel.com/640/480/city,"You can't calculate the capacitor without parsing the haptic AGP monitor!"
37,http://lorempixel.com/640/480/city,We need to transmit the auxiliary AGP bandwidth!
37,http://lorempixel.com/640/480/city,We need to compress the bluetooth THX array!
37,http://lorempixel.com/640/480/city,"I'll back up the primary THX program, that should port the AI interface!"
37,http://lorempixel.com/640/480/city,"hacking the card won't do anything, we need to quantify the primary SDD system!"
37,http://lorempixel.com/640/480/city,"generating the system won't do anything, we need to quantify the multi-byte JBOD capacitor!"
37,http://lorempixel.com/640/480/city,"If we quantify the program, we can get to the ADP sensor through the solid state CSS hard drive!"
37,http://lorempixel.com/640/480/city,"Try to override the ADP transmitter, maybe it will quantify the virtual port!"
37,http://lorempixel.com/640/480/city,"If we reboot the matrix, we can get to the GB transmitter through the solid state IB circuit!"
37,http://lorempixel.com/640/480/city,"I'll bypass the haptic HTTP card, that should system the HDD interface!"
37,http://lorempixel.com/640/480/city,"If we override the bus, we can get to the FTP alarm through the bluetooth THX system!"
38,http://lorempixel.com/640/480/city,"You can't copy the port without synthesizing the open-source SQL interface!"
38,http://lorempixel.com/640/480/city,"I'll generate the wireless SCSI capacitor, that should application the PCI program!"
38,http://lorempixel.com/640/480/city,"synthesizing the program won't do anything, we need to generate the haptic AGP firewall!"
38,http://lorempixel.com/640/480/city,"The CSS system is down, override the redundant interface so we can calculate the SSL program!"
38,http://lorempixel.com/640/480/city,"If we calculate the transmitter, we can get to the SMTP application through the open-source SSL bandwidth!"
38,http://lorempixel.com/640/480/city,"I'll program the optical SMTP alarm, that should protocol the XML pixel!"
38,http://lorempixel.com/640/480/city,"Use the cross-platform EXE hard drive, then you can compress the virtual system!"
38,http://lorempixel.com/640/480/city,"You can't transmit the pixel without compressing the mobile SQL transmitter!"
38,http://lorempixel.com/640/480/city,"Use the digital RAM program, then you can quantify the multi-byte microchip!"
38,http://lorempixel.com/640/480/city,"Try to hack the JSON monitor, maybe it will connect the cross-platform circuit!"
39,http://lorempixel.com/640/480/city,"Try to synthesize the HTTP matrix, maybe it will bypass the multi-byte program!"
39,http://lorempixel.com/640/480/city,"The PNG transmitter is down, bypass the wireless card so we can generate the XSS driver!"
39,http://lorempixel.com/640/480/city,"Use the multi-byte HDD feed, then you can bypass the optical panel!"
39,http://lorempixel.com/640/480/city,"synthesizing the transmitter won't do anything, we need to transmit the multi-byte SSL feed!"
39,http://lorempixel.com/640/480/city,"parsing the monitor won't do anything, we need to bypass the haptic IB monitor!"
39,http://lorempixel.com/640/480/city,"Try to parse the SMS microchip, maybe it will back up the virtual interface!"
39,http://lorempixel.com/640/480/city,"calculating the matrix won't do anything, we need to quantify the redundant SDD feed!"
39,http://lorempixel.com/640/480/city,"You can't back up the bandwidth without hacking the redundant SSL application!"
39,http://lorempixel.com/640/480/city,"Use the bluetooth XML feed, then you can input the 1080p program!"
39,http://lorempixel.com/640/480/city,"Use the multi-byte AGP protocol, then you can index the mobile feed!"
39,http://lorempixel.com/640/480/city,We need to navigate the online HDD sensor!
39,http://lorempixel.com/640/480/city,"You can't override the circuit without synthesizing the back-end SAS microchip!"
40,http://lorempixel.com/640/480/city,"I'll index the open-source SDD hard drive, that should system the RSS alarm!"
40,http://lorempixel.com/640/480/city,"If we connect the application, we can get to the USB circuit through the mobile SSL array!"
40,http://lorempixel.com/640/480/city,We need to copy the back-end AGP application!
40,http://lorempixel.com/640/480/city,"The SMS application is down, navigate the online array so we can override the COM hard drive!"
40,http://lorempixel.com/640/480/city,We need to compress the digital RSS bandwidth!
40,http://lorempixel.com/640/480/city,"If we connect the microchip, we can get to the SMS program through the solid state AI capacitor!"
41,http://lorempixel.com/640/480/city,"Try to synthesize the SMTP bandwidth, maybe it will synthesize the primary panel!"
41,http://lorempixel.com/640/480/city,We need to generate the redundant CSS pixel!
41,http://lorempixel.com/640/480/city,"Try to reboot the AI transmitter, maybe it will quantify the wireless bus!"
41,http://lorempixel.com/640/480/city,"The COM port is down, connect the digital array so we can compress the XSS panel!"
41,http://lorempixel.com/640/480/city,"The HDD matrix is down, back up the 1080p port so we can program the COM capacitor!"
41,http://lorempixel.com/640/480/city,"You can't synthesize the feed without programming the 1080p AGP port!"
41,http://lorempixel.com/640/480/city,"generating the card won't do anything, we need to parse the wireless HTTP capacitor!"
41,http://lorempixel.com/640/480/city,We need to parse the online CSS program!
42,http://lorempixel.com/640/480/city,"Try to generate the XSS hard drive, maybe it will quantify the primary interface!"
42,http://lorempixel.com/640/480/city,"calculating the transmitter won't do anything, we need to copy the virtual RAM feed!"
42,http://lorempixel.com/640/480/city,"You can't input the system without generating the primary PCI circuit!"
42,http://lorempixel.com/640/480/city,"The PCI firewall is down, override the cross-platform bus so we can copy the USB hard drive!"
42,http://lorempixel.com/640/480/city,"Try to parse the XSS transmitter, maybe it will copy the online interface!"
42,http://lorempixel.com/640/480/city,"transmitting the capacitor won't do anything, we need to generate the neural AGP system!"
42,http://lorempixel.com/640/480/city,"The GB matrix is down, program the optical interface so we can override the RAM firewall!"
42,http://lorempixel.com/640/480/city,"Try to generate the PNG circuit, maybe it will calculate the neural alarm!"
42,http://lorempixel.com/640/480/city,"copying the matrix won't do anything, we need to compress the primary AI transmitter!"
42,http://lorempixel.com/640/480/city,We need to parse the neural SMTP array!
42,http://lorempixel.com/640/480/city,"Use the auxiliary USB array, then you can compress the redundant capacitor!"
42,http://lorempixel.com/640/480/city,"Use the haptic SDD matrix, then you can override the bluetooth transmitter!"
43,http://lorempixel.com/640/480/city,"You can't parse the application without calculating the bluetooth EXE bus!"
43,http://lorempixel.com/640/480/city,"navigating the protocol won't do anything, we need to hack the 1080p JSON protocol!"
43,http://lorempixel.com/640/480/city,"Use the bluetooth JBOD driver, then you can bypass the digital matrix!"
43,http://lorempixel.com/640/480/city,"indexing the circuit won't do anything, we need to parse the primary RSS firewall!"
43,http://lorempixel.com/640/480/city,"Try to program the HTTP feed, maybe it will hack the redundant bus!"
43,http://lorempixel.com/640/480/city,We need to generate the back-end PNG microchip!
43,http://lorempixel.com/640/480/city,"If we bypass the monitor, we can get to the SCSI sensor through the solid state RSS panel!"
43,http://lorempixel.com/640/480/city,"Try to copy the PNG bandwidth, maybe it will compress the back-end alarm!"
43,http://lorempixel.com/640/480/city,"If we input the application, we can get to the AGP system through the solid state JBOD pixel!"
43,http://lorempixel.com/640/480/city,"I'll reboot the digital USB bus, that should port the RAM pixel!"
43,http://lorempixel.com/640/480/city,"Use the mobile COM panel, then you can transmit the mobile sensor!"
43,http://lorempixel.com/640/480/city,"You can't navigate the protocol without transmitting the optical EXE array!"
43,http://lorempixel.com/640/480/city,We need to program the redundant RSS panel!
44,http://lorempixel.com/640/480/city,"The IB matrix is down, generate the optical port so we can index the RAM alarm!"
44,http://lorempixel.com/640/480/city,"You can't input the port without copying the haptic SMS port!"
44,http://lorempixel.com/640/480/city,"You can't copy the array without synthesizing the open-source PNG interface!"
44,http://lorempixel.com/640/480/city,"I'll override the mobile SMTP microchip, that should port the IB protocol!"
44,http://lorempixel.com/640/480/city,We need to navigate the cross-platform IB sensor!
45,http://lorempixel.com/640/480/city,"You can't input the program without bypassing the virtual ADP program!"
45,http://lorempixel.com/640/480/city,"You can't generate the firewall without backing up the digital CSS system!"
45,http://lorempixel.com/640/480/city,"You can't synthesize the firewall without parsing the back-end IB driver!"
45,http://lorempixel.com/640/480/city,We need to index the 1080p PNG capacitor!
45,http://lorempixel.com/640/480/city,"Use the primary JBOD interface, then you can hack the multi-byte monitor!"
45,http://lorempixel.com/640/480/city,"Use the 1080p AGP panel, then you can copy the open-source system!"
45,http://lorempixel.com/640/480/city,"bypassing the array won't do anything, we need to compress the optical SMS program!"
45,http://lorempixel.com/640/480/city,"I'll compress the wireless SMTP panel, that should array the PNG driver!"
45,http://lorempixel.com/640/480/city,"Use the online PCI system, then you can override the primary protocol!"
46,http://lorempixel.com/640/480/city,"The XML microchip is down, index the haptic hard drive so we can hack the TCP monitor!"
46,http://lorempixel.com/640/480/city,"Try to override the XML alarm, maybe it will transmit the open-source bus!"
46,http://lorempixel.com/640/480/city,"The RAM matrix is down, back up the multi-byte hard drive so we can back up the JBOD card!"
46,http://lorempixel.com/640/480/city,"Use the solid state SSL matrix, then you can hack the digital firewall!"
46,http://lorempixel.com/640/480/city,"You can't parse the card without hacking the wireless TCP hard drive!"
46,http://lorempixel.com/640/480/city,"The TCP port is down, generate the open-source pixel so we can override the SMS driver!"
46,http://lorempixel.com/640/480/city,"Use the 1080p COM array, then you can compress the primary feed!"
46,http://lorempixel.com/640/480/city,"Try to connect the EXE program, maybe it will compress the open-source capacitor!"
46,http://lorempixel.com/640/480/city,"I'll parse the open-source HDD microchip, that should circuit the XSS pixel!"
47,http://lorempixel.com/640/480/city,"bypassing the transmitter won't do anything, we need to input the 1080p XSS monitor!"
47,http://lorempixel.com/640/480/city,"I'll connect the haptic AI interface, that should hard drive the FTP application!"
47,http://lorempixel.com/640/480/city,We need to parse the neural SDD transmitter!
47,http://lorempixel.com/640/480/city,"You can't generate the sensor without synthesizing the 1080p SQL panel!"
47,http://lorempixel.com/640/480/city,"Use the haptic USB program, then you can hack the open-source port!"
47,http://lorempixel.com/640/480/city,"If we connect the feed, we can get to the COM alarm through the multi-byte THX transmitter!"
48,http://lorempixel.com/640/480/city,We need to index the haptic ADP microchip!
48,http://lorempixel.com/640/480/city,"Try to synthesize the XSS driver, maybe it will hack the redundant system!"
48,http://lorempixel.com/640/480/city,"Use the wireless RAM transmitter, then you can input the haptic pixel!"
48,http://lorempixel.com/640/480/city,"I'll index the virtual XSS system, that should alarm the GB driver!"
48,http://lorempixel.com/640/480/city,"Try to copy the HTTP matrix, maybe it will index the cross-platform alarm!"
48,http://lorempixel.com/640/480/city,"The USB bus is down, reboot the digital transmitter so we can synthesize the XML panel!"
48,http://lorempixel.com/640/480/city,"calculating the circuit won't do anything, we need to input the 1080p SQL matrix!"
48,http://lorempixel.com/640/480/city,"I'll compress the 1080p SAS bus, that should alarm the COM circuit!"
48,http://lorempixel.com/640/480/city,"I'll override the multi-byte SCSI application, that should alarm the ADP monitor!"
48,http://lorempixel.com/640/480/city,"The JSON array is down, program the neural matrix so we can program the TCP matrix!"
49,http://lorempixel.com/640/480/city,"transmitting the program won't do anything, we need to program the digital HDD driver!"
49,http://lorempixel.com/640/480/city,"indexing the array won't do anything, we need to synthesize the optical HTTP capacitor!"
49,http://lorempixel.com/640/480/city,"Use the neural AGP program, then you can calculate the 1080p card!"
49,http://lorempixel.com/640/480/city,"I'll hack the multi-byte SDD pixel, that should protocol the RAM microchip!"
49,http://lorempixel.com/640/480/city,"Use the 1080p PNG panel, then you can navigate the solid state alarm!"
49,http://lorempixel.com/640/480/city,"Use the wireless TCP transmitter, then you can back up the mobile protocol!"
49,http://lorempixel.com/640/480/city,"copying the capacitor won't do anything, we need to transmit the optical RAM circuit!"
49,http://lorempixel.com/640/480/city,"I'll program the back-end HTTP panel, that should sensor the SQL capacitor!"
49,http://lorempixel.com/640/480/city,"You can't hack the matrix without parsing the online AI hard drive!"