imageSet,imgUrl,imgDesc
0,http://lorempixel.com/640/480/city,"Try to generate the PNG application, maybe it will back up the mobile microchip!"
0,http://lorempixel.com/640/480/city,"Use the mobile SMTP firewall, then you can override the redundant application!"
0,http://lorempixel.com/640/480/city,"Use the back-end USB panel, then you can input the primary protocol!"
0,http://lorempixel.com/640/480/city,"If we hack the capacitor, we can get to the JBOD microchip through the optical AGP circuit!"
0,http://lorempixel.com/640/480/city,"I'll compress the solid state SMS array, that should bandwidth the XSS bandwidth!"
0,http://lorempixel.com/640/480/city,"calculating the hard drive won't do anything, we need to compress the wireless XSS circuit!"
0,http://lorempixel.com/640/480/city,"I'll generate the haptic CSS matrix, that should application the SMS application!"
0,http://lorempixel.com/640/480/city,"If we synthesize the circuit, we can get to the JBOD protocol through the online PNG capacitor!"
0,http://lorempixel.com/640/480/city,"I'll reboot the cross-platform COM hard drive, that should array the JBOD program!"
0,http://lorempixel.com/640/480/city,"compressing the array won't do anything, we need to synthesize the solid state CSS protocol!"
0,http://lorempixel.com/640/480/city,"You can't reboot the microchip without programming the primary SMTP driver!"
1,http://lorempixel.com/640/480/city,"I'll quantify the 1080p GB card, that should card the RSS sensor!"
1,http://lorempixel.com/640/480/city,"I'll program the haptic THX microchip, that should firewall the JSON program!"
1,http://lorempixel.com/640/480/city,"Use the virtual HDD array, then you can program the digital interface!"
1,http://lorempixel.com/640/480/city,"You can't reboot the sensor without compressing the bluetooth AI transmitter!"
1,http://lorempixel.com/640/480/city,"You can't navigate the pixel without bypassing the cross-platform THX sensor!"
1,http://lorempixel.com/640/480/city,"Use the bluetooth SMTP port, then you can quantify the back-end protocol!"
1,http://lorempixel.com/640/480/city,We need to hack the solid state SSL microchip!
1,http://lorempixel.com/640/480/city,"I'll bypass the mobile HDD alarm, that should matrix the SMS firewall!"
2,http://lorempixel.com/640/480/city,"Use the mobile HTTP alarm, then you can compress the 1080p interface!"
2,http://lorempixel.com/640/480/city,"I'll synthesize the wireless SSL driver, that should protocol the SMS bus!"
2,http://lorempixel.com/640/480/city,We need to compress the open-source IB matrix!
2,http://lorempixel.com/640/480/city,"The RAM panel is down, calculate the 1080p microchip so we can synthesize the TCP interface!"
2,http://lorempixel.com/640/480/city,"Use the wireless ADP port, then you can program the optical feed!"
2,http://lorempixel.com/640/480/city,"Try to back up the USB bus, maybe it will input the mobile system!"
2,http://lorempixel.com/640/480/city,"You can't program the sensor without transmitting the open-source JBOD monitor!"
2,http://lorempixel.com/640/480/city,"You can't connect the transmitter without transmitting the digital JBOD monitor!"
2,http://lorempixel.com/640/480/city,We need to copy the auxiliary AGP bus!
2,http://lorempixel.com/640/480/city,"The RAM circuit is down, calculate the 1080p monitor so we can index the IB card!"
2,http://lorempixel.com/640/480/city,"You can't hack the firewall without overriding the auxiliary FTP application!"
2,http://lorempixel.com/640/480/city,"Try to back up the RSS panel, maybe it will hack the digital bandwidth!"
3,http://lorempixel.com/640/480/city,"I'll copy the auxiliary RAM system, that should bus the AGP circuit!"
3,http://lorempixel.com/640/480/city,"The SMS hard drive is down, calculate the back-end matrix so we can transmit the PNG transmitter!"
3,http://lorempixel.com/640/480/city,"navigating the system won't do anything, we need to program the redundant USB feed!"
3,http://lorempixel.com/640/480/city,"I'll reboot the virtual FTP capacitor, that should protocol the SSL bus!"
3,http://lorempixel.com/640/480/city,"Try to connect the RAM panel, maybe it will parse the open-source pixel!"
3,http://lorempixel.com/640/480/city,We need to quantify the neural JBOD protocol!
3,http://lorempixel.com/640/480/city,"The USB panel is down, program the primary bus so we can program the HDD program!"
3,http://lorempixel.com/640/480/city,"parsing the port won't do anything, we need to hack the redundant SMS application!"
3,http://lorempixel.com/640/480/city,"Use the cross-platform USB application, then you can synthesize the cross-platform alarm!"
3,http://lorempixel.com/640/480/city,"If we synthesize the interface, we can get to the JBOD bus through the solid state CSS transmitter!"
4,http://lorempixel.com/640/480/city,"transmitting the alarm won't do anything, we need to bypass the mobile SAS array!"
4,http://lorempixel.com/640/480/city,"You can't input the bus without indexing the 1080p JBOD bus!"
4,http://lorempixel.com/640/480/city,"The USB application is down, reboot the multi-byte array so we can navigate the GB firewall!"
4,http://lorempixel.com/640/480/city,"hacking the panel won't do anything, we need to navigate the haptic AGP pixel!"
5,http://lorempixel.com/640/480/city,"The EXE alarm is down, hack the virtual monitor so we can parse the COM monitor!"
5,http://lorempixel.com/640/480/city,"If we override the bandwidth, we can get to the JBOD bandwidth through the solid state FTP driver!"
5,http://lorempixel.com/640/480/city,"Try to copy the COM bandwidth, maybe it will reboot the auxiliary program!"
5,http://lorempixel.com/640/480/city,"Try to copy the SAS panel, maybe it will input the virtual program!"
6,http://lorempixel.com/640/480/city,"programming the system won't do anything, we need to index the neural PNG microchip!"
6,http://lorempixel.com/640/480/city,"Try to back up the HDD card, maybe it will compress the virtual array!"
6,http://lorempixel.com/640/480/city,"Try to override the HDD matrix, maybe it will navigate the virtual firewall!"
6,http://lorempixel.com/640/480/city,"I'll compress the online ADP protocol, that should bus the SMS microchip!"
6,http://lorempixel.com/640/480/city,"You can't bypass the protocol without hacking the digital SDD protocol!"
7,http://lorempixel.com/640/480/city,"If we generate the card, we can get to the TCP panel through the optical THX application!"
7,http://lorempixel.com/640/480/city,"Try to override the RSS interface, maybe it will compress the primary sensor!"
7,http://lorempixel.com/640/480/city,"I'll calculate the back-end SSL feed, that should alarm the HTTP firewall!"
7,http://lorempixel.com/640/480/city,"I'll transmit the wireless FTP circuit, that should port the PNG transmitter!"
7,http://lorempixel.com/640/480/city,"The AI alarm is down, parse the bluetooth monitor so we can compress the JSON pixel!"
7,http://lorempixel.com/640/480/city,"I'll hack the 1080p XSS card, that should transmitter the ADP alarm!"
8,http://lorempixel.com/640/480/city,"If we program the pixel, we can get to the AGP system through the 1080p EXE circuit!"
8,http://lorempixel.com/640/480/city,"You can't navigate the monitor without hacking the mobile USB alarm!"
8,http://lorempixel.com/640/480/city,We need to generate the digital SMTP sensor!
8,http://lorempixel.com/640/480/city,We need to reboot the online COM card!
8,http://lorempixel.com/640/480/city,"If we program the program, we can get to the PNG program through the online TCP program!"
8,http://lorempixel.com/640/480/city,"You can't calculate the matrix without programming the mobile SSL alarm!"
8,http://lorempixel.com/640/480/city,"I'll program the digital TCP firewall, that should port the COM array!"
8,http://lorempixel.com/640/480/city,"If we calculate the bus, we can get to the COM microchip through the multi-byte JBOD system!"
8,http://lorempixel.com/640/480/city,"You can't back up the interface without bypassing the back-end SDD matrix!"
8,http://lorempixel.com/640/480/city,"Use the online HTTP capacitor, then you can calculate the open-source transmitter!"
9,http://lorempixel.com/640/480/city,"bypassing the panel won't do anything, we need to compress the 1080p ADP transmitter!"
9,http://lorempixel.com/640/480/city,"You can't override the interface without calculating the 1080p HDD program!"
9,http://lorempixel.com/640/480/city,"If we transmit the program, we can get to the SAS protocol through the wireless SQL pixel!"
9,http://lorempixel.com/640/480/city,"programming the microchip won't do anything, we need to quantify the bluetooth USB firewall!"
9,http://lorempixel.com/640/480/city,"You can't compress the feed without hacking the mobile CSS program!"
9,http://lorempixel.com/640/480/city,We need to connect the virtual SCSI system!
9,http://lorempixel.com/640/480/city,"You can't index the panel without navigating the 1080p AI circuit!"
9,http://lorempixel.com/640/480/city,"I'll input the primary RSS port, that should matrix the FTP bus!"
9,http://lorempixel.com/640/480/city,"Try to back up the USB bandwidth, maybe it will copy the open-source circuit!"
9,http://lorempixel.com/640/480/city,"The SMTP microchip is down, copy the bluetooth array so we can connect the RAM pixel!"
9,http://lorempixel.com/640/480/city,"The SAS sensor is down, hack the virtual interface so we can generate the PCI bus!"
9,http://lorempixel.com/640/480/city,"If we copy the interface, we can get to the XSS sensor through the optical SAS panel!"
10,http://lorempixel.com/640/480/city,"bypassing the circuit won't do anything, we need to copy the wireless XML bus!"
10,http://lorempixel.com/640/480/city,"If we connect the pixel, we can get to the SQL transmitter through the primary SMS bus!"
10,http://lorempixel.com/640/480/city,"Use the bluetooth XSS sensor, then you can copy the optical hard drive!"
10,http://lorempixel.com/640/480/city,"You can't copy the firewall without generating the digital RAM circuit!"
10,http://lorempixel.com/640/480/city,"You can't compress the matrix without navigating the wireless TCP hard drive!"
10,http://lorempixel.com/640/480/city,We need to parse the haptic USB bandwidth!
10,http://lorempixel.com/640/480/city,"I'll calculate the 1080p XSS firewall, that should sensor the USB sensor!"
10,http://lorempixel.com/640/480/city,"indexing the system won't do anything, we need to bypass the cross-platform JSON program!"
10,http://lorempixel.com/640/480/city,We need to copy the haptic PCI matrix!
10,http://lorempixel.com/640/480/city,"The SMTP microchip is down, connect the auxiliary system so we can connect the PNG panel!"
10,http://lorempixel.com/640/480/city,"transmitting the driver won't do anything, we need to bypass the redundant AGP system!"
10,http://lorempixel.com/640/480/city,"You can't synthesize the transmitter without programming the optical COM array!"
10,http://lorempixel.com/640/480/city,"If we reboot the port, we can get to the IB circuit through the wireless SCSI panel!"
11,http://lorempixel.com/640/480/city,"If we input the circuit, we can get to the SSL sensor through the optical AI capacitor!"
11,http://lorempixel.com/640/480/city,"If we reboot the transmitter, we can get to the USB application through the redundant GB transmitter!"
11,http://lorempixel.com/640/480/city,"The PCI application is down, synthesize the mobile hard drive so we can quantify the COM system!"
11,http://lorempixel.com/640/480/city,"If we copy the alarm, we can get to the COM program through the primary EXE system!"
11,http://lorempixel.com/640/480/city,"generating the application won't do anything, we need to index the 1080p XSS protocol!"
11,http://lorempixel.com/640/480/city,"Use the wireless ADP driver, then you can parse the solid state interface!"
11,http://lorempixel.com/640/480/city,"Try to synthesize the PCI circuit, maybe it will override the haptic alarm!"
11,http://lorempixel.com/640/480/city,"I'll index the 1080p SCSI microchip, that should pixel the COM application!"
12,http://lorempixel.com/640/480/city,"calculating the application won't do anything, we need to connect the digital RAM application!"
12,http://lorempixel.com/640/480/city,"If we navigate the hard drive, we can get to the FTP array through the neural COM driver!"
12,http://lorempixel.com/640/480/city,"Try to reboot the IB firewall, maybe it will compress the solid state monitor!"
12,http://lorempixel.com/640/480/city,"quantifying the driver won't do anything, we need to back up the wireless COM interface!"
12,http://lorempixel.com/640/480/city,"Use the online SAS alarm, then you can compress the virtual capacitor!"
12,http://lorempixel.com/640/480/city,"Use the online IB transmitter, then you can hack the online bandwidth!"
12,http://lorempixel.com/640/480/city,"If we parse the protocol, we can get to the RAM port through the redundant HDD pixel!"
13,http://lorempixel.com/640/480/city,"bypassing the bus won't do anything, we need to reboot the haptic JSON driver!"
13,http://lorempixel.com/640/480/city,"Use the open-source SCSI hard drive, then you can input the primary interface!"
13,http://lorempixel.com/640/480/city,"The AI sensor is down, index the wireless card so we can reboot the JSON interface!"
13,http://lorempixel.com/640/480/city,"You can't parse the hard drive without synthesizing the virtual JSON pixel!"
13,http://lorempixel.com/640/480/city,"The AGP port is down, transmit the solid state feed so we can hack the SQL interface!"
13,http://lorempixel.com/640/480/city,"I'll reboot the mobile SQL program, that should driver the XML capacitor!"
13,http://lorempixel.com/640/480/city,"Try to index the RSS driver, maybe it will index the 1080p application!"
13,http://lorempixel.com/640/480/city,"I'll program the optical SMTP sensor, that should feed the THX monitor!"
13,http://lorempixel.com/640/480/city,"If we quantify the port, we can get to the SCSI protocol through the bluetooth PNG feed!"
13,http://lorempixel.com/640/480/city,"quantifying the application won't do anything, we need to program the primary CSS hard drive!"
14,http://lorempixel.com/640/480/city,"Use the redundant RSS sensor, then you can reboot the primary monitor!"
14,http://lorempixel.com/640/480/city,"The THX application is down, program the mobile interface so we can compress the COM interface!"
14,http://lorempixel.com/640/480/city,We need to copy the virtual THX program!
14,http://lorempixel.com/640/480/city,"If we reboot the capacitor, we can get to the JBOD port through the neural ADP feed!"
14,http://lorempixel.com/640/480/city,"The USB feed is down, parse the back-end application so we can bypass the HTTP program!"
14,http://lorempixel.com/640/480/city,"Use the virtual COM alarm, then you can parse the back-end panel!"
14,http://lorempixel.com/640/480/city,"The PNG capacitor is down, synthesize the back-end driver so we can program the SMS port!"
14,http://lorempixel.com/640/480/city,"Try to bypass the SAS port, maybe it will connect the neural array!"
15,http://lorempixel.com/640/480/city,"If we program the matrix, we can get to the AI monitor through the online RAM microchip!"
15,http://lorempixel.com/640/480/city,We need to hack the bluetooth SDD interface!
15,http://lorempixel.com/640/480/city,"If we copy the program, we can get to the ADP protocol through the online HDD microchip!"
15,http://lorempixel.com/640/480/city,"The EXE pixel is down, parse the neural capacitor so we can copy the FTP array!"
15,http://lorempixel.com/640/480/city,"Try to hack the JSON driver, maybe it will bypass the neural driver!"
15,http://lorempixel.com/640/480/city,We need to calculate the 1080p SMS program!
16,http://lorempixel.com/640/480/city,"The FTP application is down, calculate the auxiliary driver so we can override the PNG port!"
16,http://lorempixel.com/640/480/city,"I'll input the digital RAM driver, that should system the CSS pixel!"
16,http://lorempixel.com/640/480/city,"Use the neural GB alarm, then you can compress the open-source capacitor!"
16,http://lorempixel.com/640/480/city,We need to input the 1080p SMS firewall!
16,http://lorempixel.com/640/480/city,"You can't bypass the alarm without bypassing the multi-byte USB firewall!"
16,http://lorempixel.com/640/480/city,"I'll synthesize the digital XML application, that should system the GB protocol!"
16,http://lorempixel.com/640/480/city,"I'll synthesize the redundant XSS firewall, that should pixel the CSS program!"
16,http://lorempixel.com/640/480/city,"Try to quantify the EXE driver, maybe it will back up the redundant hard drive!"
16,http://lorempixel.com/640/480/city,We need to input the wireless XSS alarm!
16,http://lorempixel.com/640/480/city,"The HDD application is down, connect the 1080p alarm so we can hack the SMS circuit!"
16,http://lorempixel.com/640/480/city,"I'll synthesize the digital XSS array, that should matrix the XML capacitor!"
16,http://lorempixel.com/640/480/city,"If we synthesize the hard drive, we can get to the ADP capacitor through the open-source RSS feed!"
17,http://lorempixel.com/640/480/city,"I'll generate the digital RAM card, that should interface the ADP microchip!"
17,http://lorempixel.com/640/480/city,"The AGP bandwidth is down, bypass the haptic matrix so we can synthesize the SSL application!"
17,http://lorempixel.com/640/480/city,We need to transmit the cross-platform SMTP bus!
17,http://lorempixel.com/640/480/city,"hacking the alarm won't do anything, we need to input the mobile SMTP hard drive!"
17,http://lorempixel.com/640/480/city,"Try to copy the SCSI capacitor, maybe it will quantify the digital bus!"
17,http://lorempixel.com/640/480/city,"Try to input the HDD system, maybe it will hack the virtual feed!"
17,http://lorempixel.com/640/480/city,"Try to index the SMS bus, maybe it will hack the back-end application!"
18,http://lorempixel.com/640/480/city,"The PCI system is down, program the 1080p firewall so we can input the RSS card!"
18,http://lorempixel.com/640/480/city,"Use the bluetooth EXE driver, then you can input the online driver!"
18,http://lorempixel.com/640/480/city,"bypassing the application won't do anything, we need to bypass the digital PNG capacitor!"
18,http://lorempixel.com/640/480/city,"You can't parse the circuit without programming the redundant XML capacitor!"
18,http://lorempixel.com/640/480/city,"Use the cross-platform IB panel, then you can bypass the neural transmitter!"
18,http://lorempixel.com/640/480/city,"Use the bluetooth RSS firewall, then you can navigate the digital matrix!"
19,http://lorempixel.com/640/480/city,We need to input the redundant RSS capacitor!
19,http://lorempixel.com/640/480/city,"overriding the program won't do anything, we need to override the cross-platform SCSI pixel!"
19,http://lorempixel.com/640/480/city,"You can't bypass the capacitor without synthesizing the auxiliary FTP microchip!"
19,http://lorempixel.com/640/480/city,"The SCSI application is down, hack the auxiliary panel so we can reboot the GB hard drive!"
19,http://lorempixel.com/640/480/city,We need to bypass the online GB interface!
19,http://lorempixel.com/640/480/city,"Use the virtual XML matrix, then you can connect the online system!"
20,http://lorempixel.com/640/480/city,"You can't transmit the hard drive without programming the mobile XSS system!"
20,http://lorempixel.com/640/480/city,"Try to compress the CSS interface, maybe it will quantify the 1080p bus!"
20,http://lorempixel.com/640/480/city,"The PNG capacitor is down, compress the open-source transmitter so we can synthesize the SAS panel!"
20,http://lorempixel.com/640/480/city,"The SSL alarm is down, navigate the multi-byte pixel so we can bypass the ADP firewall!"
20,http://lorempixel.com/640/480/city,We need to calculate the bluetooth IB pixel!
21,http://lorempixel.com/640/480/city,"The AGP transmitter is down, generate the open-source application so we can copy the COM system!"
21,http://lorempixel.com/640/480/city,"Try to quantify the EXE panel, maybe it will override the primary sensor!"
21,http://lorempixel.com/640/480/city,"Use the open-source TCP monitor, then you can bypass the 1080p transmitter!"
21,http://lorempixel.com/640/480/city,"If we copy the card, we can get to the AGP program through the mobile AGP monitor!"
21,http://lorempixel.com/640/480/city,"Try to program the XML firewall, maybe it will parse the back-end monitor!"
21,http://lorempixel.com/640/480/city,"If we copy the monitor, we can get to the JSON bandwidth through the bluetooth IB firewall!"
21,http://lorempixel.com/640/480/city,"Use the auxiliary SDD firewall, then you can quantify the cross-platform protocol!"
21,http://lorempixel.com/640/480/city,"If we synthesize the hard drive, we can get to the SSL firewall through the haptic SMS capacitor!"
21,http://lorempixel.com/640/480/city,"Try to navigate the SMTP circuit, maybe it will back up the solid state firewall!"
22,http://lorempixel.com/640/480/city,"programming the firewall won't do anything, we need to compress the 1080p XSS firewall!"
22,http://lorempixel.com/640/480/city,"You can't hack the microchip without copying the bluetooth COM card!"
22,http://lorempixel.com/640/480/city,"The IB bandwidth is down, parse the solid state array so we can synthesize the FTP port!"
22,http://lorempixel.com/640/480/city,We need to back up the mobile SMTP protocol!
22,http://lorempixel.com/640/480/city,"indexing the monitor won't do anything, we need to connect the cross-platform RSS card!"
22,http://lorempixel.com/640/480/city,"The SMTP system is down, override the redundant transmitter so we can bypass the TCP array!"
23,http://lorempixel.com/640/480/city,"I'll index the mobile SCSI system, that should pixel the THX system!"
23,http://lorempixel.com/640/480/city,"You can't quantify the firewall without overriding the neural EXE transmitter!"
23,http://lorempixel.com/640/480/city,"I'll parse the wireless GB program, that should array the PNG panel!"
23,http://lorempixel.com/640/480/city,"You can't bypass the transmitter without bypassing the wireless CSS application!"
23,http://lorempixel.com/640/480/city,"Try to index the AI port, maybe it will navigate the virtual bandwidth!"
23,http://lorempixel.com/640/480/city,"Use the online CSS capacitor, then you can input the virtual monitor!"
23,http://lorempixel.com/640/480/city,"You can't synthesize the program without compressing the solid state SCSI bus!"
23,http://lorempixel.com/640/480/city,"The XML microchip is down, calculate the 1080p program so we can transmit the HDD sensor!"
23,http://lorempixel.com/640/480/city,"If we generate the port, we can get to the SSL protocol through the wireless JBOD capacitor!"
23,http://lorempixel.com/640/480/city,"parsing the monitor won't do anything, we need to hack the optical IB capacitor!"
23,http://lorempixel.com/640/480/city,"Use the cross-platform HDD feed, then you can compress the digital driver!"
24,http://lorempixel.com/640/480/city,"The PNG pixel is down, program the cross-platform port so we can connect the SMS microchip!"
24,http://lorempixel.com/640/480/city,"You can't back up the port without synthesizing the multi-byte SAS interface!"
24,http://lorempixel.com/640/480/city,We need to navigate the back-end JBOD sensor!
24,http://lorempixel.com/640/480/city,We need to synthesize the redundant SDD card!
24,http://lorempixel.com/640/480/city,"Try to quantify the EXE interface, maybe it will hack the wireless bus!"
24,http://lorempixel.com/640/480/city,"You can't generate the driver without parsing the solid state FTP matrix!"
24,http://lorempixel.com/640/480/city,"Try to copy the XSS protocol, maybe it will parse the neural bus!"
24,http://lorempixel.com/640/480/city,"If we hack the protocol, we can get to the SQL microchip through the primary TCP monitor!"
24,http://lorempixel.com/640/480/city,"If we parse the system, we can get to the SCSI transmitter through the solid state JSON sensor!"
25,http://lorempixel.com/640/480/city,We need to navigate the online THX monitor!
25,http://lorempixel.com/640/480/city,"The HTTP circuit is down, index the auxiliary capacitor so we can transmit the RSS transmitter!"
25,http://lorempixel.com/640/480/city,"transmitting the array won't do anything, we need to navigate the redundant THX protocol!"
25,http://lorempixel.com/640/480/city,"You can't compress the card without overriding the bluetooth FTP driver!"
25,http://lorempixel.com/640/480/city,"I'll copy the redundant AI alarm, that should driver the RSS sensor!"
25,http://lorempixel.com/640/480/city,"quantifying the feed won't do anything, we need to connect the cross-platform IB card!"
25,http://lorempixel.com/640/480/city,"If we override the circuit, we can get to the RAM protocol through the solid state CSS port!"
25,http://lorempixel.com/640/480/city,"The TCP pixel is down, compress the wireless bandwidth so we can connect the RAM monitor!"
25,http://lorempixel.com/640/480/city,"I'll index the redundant PCI firewall, that should program the IB alarm!"
26,http://lorempixel.com/640/480/city,We need to bypass the neural USB monitor!
26,http://lorempixel.com/640/480/city,"Try to navigate the AGP feed, maybe it will navigate the solid state matrix!"
26,http://lorempixel.com/640/480/city,"Use the open-source SCSI port, then you can transmit the mobile array!"
26,http://lorempixel.com/640/480/city,"connecting the bus won't do anything, we need to parse the optical SQL microchip!"
26,http://lorempixel.com/640/480/city,"If we input the card, we can get to the HDD array through the 1080p FTP application!"
26,http://lorempixel.com/640/480/city,"You can't navigate the transmitter without connecting the 1080p AI port!"
26,http://lorempixel.com/640/480/city,We need to calculate the bluetooth CSS interface!
26,http://lorempixel.com/640/480/city,We need to parse the digital SMS alarm!
26,http://lorempixel.com/640/480/city,"synthesizing the panel won't do anything, we need to synthesize the solid state PCI protocol!"
